Hook Text,Category,Filming Instructions
"Tu problema no es el mercado. Es la forma en la que estás invirtiendo.",Problem-Solution,"Guille opens laptop showing property listings, crosses out prices with red marker, then reveals strategy document."
"Invertiste bien... según tu cuñado. Por eso no ves ni 1.000€/mes.",Problem-Solution,"Guille on phone call, nods while family member talks, then shows disappointed bank account on phone."
"Sabes que, yo también me sentía atrapado... hasta que aprendí a hacer que una propiedad trabaje por mí.",Transformation,"Guille starts stressed in office chair, then transitions to relaxed pose checking rental income on phone."
"No necesitas ser rico para invertir bien. Solo necesitas dejar de seguir consejos malos.",Problem-Solution,"Guille throws away financial advice books, replaces with simple strategy document."
"Necesitas 5 propiedades para llegar a 7.800€/mes. Cuando yo lo hago con una sola.",Number-Driven,"Guille shows 5 property keys in one hand, then single key in other with same income number."
"Yo también pensaba que necesitaba 5 pisos para vivir bien. Hasta que comencé a aplicar esto en mi propiedad.",Transformation,"Guille looks overwhelmed holding 5 keys, then relaxed with single key."
"Si estas por comprar tu primer piso, necesitas ver esto. Podrías estar tirando el dinero.",Urgency,"Guille about to sign contract, stops and points to camera."
"Tu primer piso puede ayudarte a crecer y pagarte la vida entera... Solo si sigues estos consejos",Educational,"Guille holds single property key that transforms into multiple keys and cash."
"El error número uno que comete la mayoría al invertir en su primer piso... es pensar que con uno no pueden vivir de ello.",Problem-Solution,"Guille dismisses single property, then reveals it generates full income."
"Últimamente, mi parte favorita de invertir es esto: hacer que una sola propiedad pague más que cinco alquiladas mal.",Number-Driven,"Guille shows comparison: 5 properties with low income vs 1 property with high income."
"Ah, y hay algo más que casi se me olvida contarte: tu cuñado no es tu asesor financiero.",Problem-Solution,"Guille mimics family member giving advice, then crosses them out."
"El mayor error que cometí al empezar fue seguir consejos de gente que nunca ha invertido.",Problem-Solution,"Guille listens to multiple voices giving conflicting advice, then shows strategy document."
"Escucha: si te preocupa perder dinero con tu primer piso... acuérdate de esto: el problema no es el mercado. Es cómo lo haces.",Problem-Solution,"Guille worried about market charts, then reveals strategy document."
"Seguro que todos han comprado su primer piso con ilusión... pero ¿alguna vez han tenido uno que literalmente te paga la vida entera?",Aspirational,"Guille holds property key that transforms into lifestyle freedom symbols."
"Yo también pensaba que hacía falta ser rico para invertir... hasta que entendí que una propiedad bien ejecutada vence a cualquier alquiler tradicional.",Transformation,"Guille thinks about money bags, then reveals strategy beats traditional rental."
"Invertiste bien... según tu entorno. Pero si no te da ni 1.000 €/mes, algo no está funcionando.",Problem-Solution,"Guille shows property but low income, looks confused at bank statement."
"Tu primer piso puede ser una carga... o el principio de tu libertad. Todo depende de cómo lo plantees.",Transformation,"Guille holds property key that transforms from heavy weight to wings of freedom."
"¿Te preocupa hipotecarte mal? No es el piso lo que arruina, es la estrategia detrás.",Problem-Solution,"Guille worried about mortgage papers, then reveals strategy document."
"€40,000 al mes en rentas pasivas... y esto es solo el comienzo.",Number-Driven,"Guille shows monthly income counter rapidly increasing to €40,000."
"De 0 a 10 propiedades en 4 años. Sin dinero inicial propio.",Number-Driven,"Guille shows timeline animation: 0 properties to 10 properties over 4 years."
"3 errores que te cuestan €100,000 en tu primera inversión inmobiliaria.",Number-Driven,"Guille shows 3 big red X marks with €100,000 price tag."
"€500 de inversión inicial pueden generar €2,000 mensuales. Te muestro cómo.",Number-Driven,"Guille shows €500 transforming into €2,000 with multiplication effect."
"7 propiedades que compré sin dinero propio. Aquí está la estrategia.",Number-Driven,"Guille shows 7 property keys appearing without money exchange."
"Dejé mi trabajo hace 3 años. Hoy gano el triple trabajando 2 horas al día.",Transformation,"Guille shows before: office worker, after: relaxed with laptop and money."
"De empleado frustrado a inversor inmobiliario exitoso en 18 meses.",Transformation,"Guille shows frustrated employee to confident investor with property portfolio."
"Cómo pasé de alquilar un piso a ser propietario de 30 inmuebles.",Transformation,"Guille shows moving from rental contract to holding 30 property keys."
"Mi primer inmueble: un estudio de 40m². Mi portfolio actual: 30 propiedades.",Transformation,"Guille shows small studio key transforming into large portfolio of keys."
"De vivir al día a vivir de rentas. El cambio que transformó mi vida.",Transformation,"Guille shows counting coins to receiving monthly rental payments."
"El secreto que los bancos no quieren que sepas sobre financiación inmobiliaria.",Curiosity,"Guille opens mysterious envelope revealing bank secrets."
"Por qué los ricos compran inmuebles y los pobres ahorran en el banco.",Curiosity,"Guille shows split screen: rich person buying property vs poor person putting money in bank."
"Lo que aprendí perdiendo €50,000 en mi primera inversión inmobiliaria.",Curiosity,"Guille shows sad face and €50,000 disappearing, then learning moment."
"El método que me permitió jubilarme a los 35 años.",Curiosity,"Guille shows person at 35 relaxing while others still working."
"¿Por qué trabajo 2 horas al día y gano más que antes?",Curiosity,"Guille shows working briefly vs others working long hours."
"¿Cansado de trabajar para otros y enriquecer a tu jefe?",Problem-Solution,"Guille shows working hard while boss gets rich, then property income."
"Tu pensión no será suficiente para mantener tu estilo de vida. Esto sí.",Problem-Solution,"Guille shows small pension check vs large property income."
"Mientras tú ahorras en el banco, la inflación devora tu dinero.",Problem-Solution,"Guille shows money in bank shrinking while property value grows."
"¿Sigues esperando el momento perfecto para invertir en inmuebles?",Problem-Solution,"Guille shows waiting with calendar while others are buying."
"El error que comete el 90% de los inversores novatos inmobiliarios.",Problem-Solution,"Guille shows 9 out of 10 people making same mistake, 1 person doing it right."
"Mis estudiantes han comprado más de 200 propiedades este año.",Social-Proof,"Guille shows multiple people holding property keys with success counter."
"De analista de inversiones en banca a mentor inmobiliario independiente.",Credibility,"Guille shows professional transition from bank to independent success."
"Lo que 10 años en el sector inmobiliario me enseñaron.",Credibility,"Guille shows timeline of 10 years with key learning moments."
"Por qué grandes inversores con millones me consultan sus estrategias.",Credibility,"Guille shows high-end investors seeking advice from speaker."
"El método que ya usan más de 5,000 estudiantes exitosos.",Social-Proof,"Guille shows crowd of successful students with property keys."
"Los precios inmobiliarios suben, pero las oportunidades también.",Urgency,"Guille shows property prices rising but opportunities appearing."
"El mercado inmobiliario está cambiando rápidamente. ¿Estás preparado?",Urgency,"Guille shows fast-changing market indicators and concerned expression."
"Última semana para acceder al curso a este precio especial.",Urgency,"Guille shows countdown timer with special price flashing."
"Solo 100 plazas disponibles para el curso este mes.",Scarcity,"Guille shows limited seats counter decreasing rapidly."
"El momento para empezar a invertir en inmuebles es AHORA o nunca.",Urgency,"Guille shows clock ticking with NOW highlighted."
"Imagínate cobrando €3,000 mientras duermes tranquilamente.",Lifestyle,"Guille shows sleeping peacefully while money flows in."
"Mis vacaciones en Maldivas las pagaron mis inquilinos.",Lifestyle,"Guille shows tropical vacation scene with rental income paying for it."
"Libertad financiera no es un sueño. Es un plan ejecutado correctamente.",Lifestyle,"Guille shows dream to reality transformation with plan execution."
"Cómo crear un patrimonio inmobiliario que beneficie a tus hijos.",Lifestyle,"Guille shows family legacy with property portfolio for future generations."
"De estar atrapado en una oficina a tener libertad total de horarios.",Lifestyle,"Guille shows office prison to freedom with flexible schedule."
"3 tipos de propiedades que siempre dan beneficio, sin importar el mercado.",Educational,"Guille shows 3 different property types with profit indicators."
"Cómo analizar cualquier inversión inmobiliaria en solo 5 minutos.",Educational,"Guille shows stopwatch with quick analysis process."
"El truco para comprar propiedades por debajo del precio de mercado.",Educational,"Guille shows property with discount price tag and secret strategy."
"Por qué el 80% de los inversores inmobiliarios fracasan en sus primeros 2 años.",Educational,"Guille shows 8 out of 10 people failing, 2 succeeding."
"La fórmula exacta para calcular rentabilidad real de cualquier propiedad.",Educational,"Guille shows mathematical formula with property analysis."
"Si estás harto de trabajar para pagar una casa... imagina que tu casa te pague a ti.",Problem-Solution,"Guille shows working to pay house, then house paying person."
"Conseguí 7 pisos sin poner ni un euro. Literal. Te cuento cómo.",Number-Driven,"Guille shows 7 property keys appearing without money exchange."
"No necesitas ahorrar 100.000€. Necesitas saber esto.",Problem-Solution,"Guille shows large savings goal crossed out, replaced with knowledge."
"Mientras tú duermes... tus pisos pueden estar generando €3.000 al mes.",Lifestyle,"Guille shows sleeping while properties generate income."
"Invertí €500... y me genera más que mi antiguo sueldo fijo.",Number-Driven,"Guille shows small investment transforming into larger income than salary."
"Este error tonto me costó €50.000 en mi primera inversión. No lo repitas.",Problem-Solution,"Guille shows expensive mistake with warning sign."
"¿Por qué los ricos compran inmuebles mientras tú guardas el dinero en el banco?",Curiosity,"Guille shows rich vs poor money management comparison."
"¿Sabías que puedes comprarte un piso sin aval, sin ahorro y sin nómina alta?",Curiosity,"Guille shows person without traditional requirements getting property."
"Mi primer piso era un estudio de 40m². Hoy tengo 30 propiedades. No fue suerte.",Transformation,"Guille shows small studio key transforming into large portfolio."
"Los bancos no te cuentan esto... pero con esta estrategia, puedes negociar como ellos.",Curiosity,"Guille shows bank secrets revealed with negotiation strategy."
"¿Crees que necesitas 10 años para retirarte? Yo lo hice en 3... con inmuebles.",Number-Driven,"Guille shows 10 years crossed out, replaced with 3 years."
"A los 35 me jubilé. No por lotería. Por estrategia.",Transformation,"Guille shows early retirement at 35 with strategy, not luck."
"Tu pensión no va a darte la vida que esperas. Esta estrategia sí puede.",Problem-Solution,"Guille shows small pension vs large strategy income."
"Mientras tú esperas el momento perfecto... otros están comprando oportunidades.",Urgency,"Guille shows waiting while others are acting."
"Te sorprendería saber cuántos pisos puedes comprar sin tener dinero.",Curiosity,"Guille shows surprised expression with number of properties possible without money."
"¿Tienes un piso en alquiler y ya te crees inversor inmobiliario?",Problem-Solution,"Guille shows person with single rental thinking they're investor."
"Si trabajas 10 horas al día y no tienes tiempo para aprender a invertir en inmuebles... ¿cuándo lo tendrás?",Problem-Solution,"Guille shows busy person with no time vs learning opportunity."
"El miedo a equivocarte en inmobiliario te va a salir más caro que una mala inversión.",Problem-Solution,"Guille shows fear costing more than actual investment mistake."
"¿De verdad crees que invertir en pisos es 100% pasivo desde el principio?",Problem-Solution,"Guille shows reality check: initial work leads to passive income."
"¿Esperas a tener 100 mil euros para empezar a invertir? Vas tarde.",Urgency,"Guille shows large savings goal with clock showing it's too late."
"Yo también pensaba que el mercado inmobiliario era solo para ricos. Hasta que hice mi primera inversión con 5.000 €",Transformation,"Guille shows thinking market is for rich, then investing with small amount."
"No soy gurú ni millonario. Solo vivo de mis propiedades. Y tú también podrías.",Credibility,"Guille shows authentic person, not guru, with property income."
"Nadie me explicó cómo funcionaba realmente esto del alquiler. Perdí tiempo y dinero. Por eso lo cuento ahora.",Problem-Solution,"Guille shows learning from mistakes and sharing knowledge."
"Los primeros 3 meses en inmobiliario son duros. Pero los siguientes 20 años... son para ti.",Transformation,"Guille shows difficult start vs long-term benefits."
"Invertir en pisos no es magia. Es entender números, financiación y personas.",Educational,"Guille shows demystifying investment with real components."
"¿Tienes ahorros, pero no sabes en qué tipo de inmueble meterlos?",Problem-Solution,"Guille shows person with money but confused about property types."
"Si no sabes cómo se calcula la rentabilidad de un piso, aún no estás listo para invertir.",Educational,"Guille shows person needing to learn calculations before investing."
"No necesitas más dinero. Necesitas saber cómo se mueve el dinero en el sector inmobiliario.",Educational,"Guille shows knowledge over money for success."
"¿No te dan hipoteca? No es por ti. Es porque no presentaste bien la operación.",Problem-Solution,"Guille shows bank rejection vs proper presentation strategy."
"Puedes hacer inversiones inmobiliarias mientras mantienes tu trabajo... si sabes cómo.",Problem-Solution,"Guille shows balancing job and property investment."
"Vas tarde, pero no estás fuera del juego. En 2025 se abrirán muchas oportunidades inmobiliarias.",Urgency,"Guille shows late but not too late with 2025 opportunities."
"Hay zonas donde el alquiler ha subido un 40%. ¿Quién se está quedando esas rentas?",Urgency,"Guille shows rental increase with question about who's benefiting."
"Tu dinero pierde valor cada día. Un piso bien comprado no.",Problem-Solution,"Guille shows money losing value vs property maintaining/gaining value."
"La oportunidad no se ve en Idealista. Se diseña antes de entrar.",Educational,"Guille shows looking at listings vs creating opportunities."
"No hace falta esperar el 'momento perfecto'. Hace falta moverse con criterio.",Problem-Solution,"Guille shows waiting vs acting with strategy."
"Cometí todos los errores en mi primer piso. Por eso ahora sé qué no repetir.",Credibility,"Guille shows learning from mistakes to help others."
"No vendo cursos. Cuento cómo invertir sin hacer tonterías.",Credibility,"Guille shows authentic approach vs typical course selling."
"Este juego no va de comprar pisos. Va de comprar tiempo y libertad.",Lifestyle,"Guille shows property investment as freedom purchase."
"He ayudado a médicos, ingenieros y autónomos a hacer su primera inversión con cabeza.",Social-Proof,"Guille shows diverse professionals succeeding with guidance."
"Invertir en inmuebles es sencillo. Hacerlo mal también.",Educational,"Guille shows simple process but easy to do wrong."
"¿Sabías que puedes tener pisos que se pagan solos... sin tener que gestionarlos tú?",Lifestyle,"Guille shows self-paying properties with no management needed."
"La financiación es más importante que el piso que compras.",Educational,"Guille shows financing strategy over property selection."
"Si tu primera inversión inmobiliaria es mala, no harás una segunda. Así lo evitas.",Problem-Solution,"Guille shows bad first investment preventing future ones."
"Los ricos no compran casas para vivir. Compran pisos que pagan su estilo de vida.",Educational,"Guille shows rich mindset: properties as income generators."
"¿Sabes cuánto puedes ganar con solo 3 propiedades bien elegidas?",Curiosity,"Guille shows 3 properties with question about potential earnings."
"El error número 1 que cometen los nuevos inversores inmobiliarios es...",Problem-Solution,"Guille shows common rookie mistake with red X, then reveals correct approach."
"Mi nueva actividad favorita en inversión inmobiliaria es esto: encontrar oportunidades donde otros solo ven problemas.",Number-Driven,"Guille shows finding diamonds in rough properties that others overlook."
"Ah, y hay una cosa más que casi se me olvida contarte: los bancos no son tus amigos.",Problem-Solution,"Guille shows friendly bank facade, then reveals hidden fees and restrictions."
"El mayor error que cometí cuando empecé en inmobiliario fue...",Problem-Solution,"Guille shows expensive mistake with sad face, then reveals lesson learned."
"Si sigues perdiendo dinero en inversiones inmobiliarias, mira esto.",Problem-Solution,"Guille shows losing money, then reveals strategy to turn it around."
"Ignoré este consejo durante demasiado tiempo. No cometas mi error.",Problem-Solution,"Guille shows ignoring good advice, then reveals consequences and solution."
"¿Cansado de malgastar dinero en propiedades que no rentan? Yo también.",Problem-Solution,"Guille shows frustrated with bad investments, then reveals better approach."
"Deja de comprar pisos si quieres libertad financiera real.",Problem-Solution,"Guille shows buying properties wrong way, then reveals correct strategy."
"Lo estás haciendo mal. Y te está costando miles de euros.",Problem-Solution,"Guille shows wrong approach with money flying away, then correct method."
"Nadie quiere escuchar esto, pero... tu primer piso puede arruinar tu futuro financiero.",Problem-Solution,"Guille shows uncomfortable truth about first property mistakes."
"No compres propiedades. Prueba esto en su lugar.",Problem-Solution,"Guille shows traditional property buying, then reveals alternative strategy."
"TikTok me hizo comprarlo: Parte 1 - El piso que cambió mi vida.",Curiosity,"Guille shows TikTok inspiration leading to successful property investment."
"Probando la estrategia viral de inversión inmobiliaria para que tú no tengas que hacerlo.",Curiosity,"Guille shows testing popular investment method and revealing results."
"Una revisión honesta de mi primera inversión inmobiliaria después de 2 años de uso.",Credibility,"Guille shows honest assessment of investment performance over time."
"Aquí está por qué nunca volveré a comprar propiedades de esta manera.",Problem-Solution,"Guille shows bad investment experience, then reveals better approach."
"Comprar vs Alquilar: ¿cuál es mejor? Hablemos de ello.",Educational,"Guille shows comparison between buying and renting with pros and cons."
"Aquí está lo que desearía haber sabido antes de usar mi primera hipoteca.",Problem-Solution,"Guille shows mortgage mistakes, then reveals what to know beforehand."
"¿Realmente vale la pena invertir en inmuebles? Vamos a averiguarlo.",Curiosity,"Guille shows questioning investment value, then reveals analysis."
"Este truco con la financiación inmobiliaria realmente funciona.",Educational,"Guille shows financing trick that actually delivers results."
"Llamando a todos los inversores principiantes, este es para vosotros.",Educational,"Guille shows targeting beginner investors with specific advice."
"Si estás luchando con la rentabilidad de tus propiedades, necesitas ver esto.",Problem-Solution,"Guille shows struggling with low returns, then reveals solution."
"Todo inversor inmobiliario necesita esta estrategia de análisis.",Educational,"Guille shows essential analysis strategy for all property investors."
"Desearía que alguien me hubiera contado sobre la financiación creativa cuando estaba empezando.",Problem-Solution,"Guille shows wishing for knowledge about creative financing from the beginning."
"Si estás cansado de trabajar para pagar tu casa, esta estrategia es para ti.",Problem-Solution,"Guille shows working to pay mortgage, then reveals house-paying-you strategy."
"Escucha, si te preocupa que el mercado inmobiliario esté en burbuja, recuerda esto...",Problem-Solution,"Guille shows market bubble concerns, then reveals why it doesn't matter with right strategy."
"Seguro que todos han tenido un piso en alquiler, pero ¿alguna vez han tenido uno que se paga solo?",Aspirational,"Guille shows regular rental vs self-paying property."
"Por qué esta estrategia inmobiliaria es imprescindible para todo inversor.",Educational,"Guille shows essential strategy that every investor needs to know."
"3 razones por las que esta estrategia es mejor que comprar y alquilar tradicional.",Educational,"Guille shows 3 specific advantages over traditional buy-to-let."
"La diferencia entre invertir con dinero propio vs sin dinero es salvaje.",Educational,"Guille shows dramatic difference between traditional vs creative financing."
"¿Sigues usando ahorros para comprar propiedades? Aquí está por qué cambié a financiación creativa.",Problem-Solution,"Guille shows traditional savings approach vs creative financing."
"Comparé comprar con ahorros vs sin dinero. Y el ganador es...",Educational,"Guille shows comparison with clear winner revealed."
"Deja de hacer scroll si estás cansado de trabajar para otros.",Urgency,"Guille shows scrolling on phone, then reveals escape from employment."
"Si nunca has oído hablar de la financiación creativa, te estás perdiendo algo.",Curiosity,"Guille shows missing out on creative financing opportunities."
"Desearás haber encontrado esta estrategia antes.",Urgency,"Guille shows wishing you knew this strategy earlier."
"Esta es la única estrategia inmobiliaria que volvería a usar.",Credibility,"Guille shows strategy that's proven and reliable."
"Advertencia: Esta estrategia podría reemplazar todo lo que estás usando.",Curiosity,"Guille shows strategy that could replace current methods."
"Querrás guardar esta estrategia para más tarde.",Educational,"Guille shows valuable strategy worth saving."
"Esta es la guía definitiva para invertir en inmuebles sin dinero.",Educational,"Guille shows comprehensive guide for no-money-down investing."
"Estos son los mejores 30€ que he gastado en mi educación inmobiliaria.",Number-Driven,"Guille shows small investment in education that paid off big."
"Todo el mundo habla de inversión inmobiliaria. La razón podría sorprenderte.",Curiosity,"Guille shows why everyone is talking about real estate investment."
"Etiqueta a alguien que necesite ver esto.",Social-Proof,"Guille shows tagging someone who needs this information."
"Dime que eres un inversor inmobiliario sin decirme que eres un inversor inmobiliario.",Lifestyle,"Guille shows subtle signs of being a property investor."
"Mira esto antes de hacer otra inversión inmobiliaria.",Urgency,"Guille shows warning to watch before next investment."
"Envía esto a tu yo futuro.",Aspirational,"Guille shows sending valuable advice to future self."
"Conecta esto si alguna vez te has sentido igual.",Social-Proof,"Guille shows relatable feeling about property investment."
"Te reto a probar esto durante una semana.",Challenge,"Guille shows challenge to try strategy for one week."
"El error número 1 que cometí cuando empecé.",Problem-Solution,"Guille shows biggest mistake when starting out."
"Aquí está lo que nadie te cuenta sobre invertir en inmuebles.",Problem-Solution,"Guille shows hidden truths about real estate investment."
"Por qué la inversión tradicional inmobiliaria es en realidad una trampa.",Problem-Solution,"Guille shows why traditional approach is actually a trap."
"Esta es la razón por la que tu inversión inmobiliaria no está funcionando.",Problem-Solution,"Guille shows why current investment isn't working."
"Probé todo para mejorar la rentabilidad hasta que encontré esto.",Problem-Solution,"Guille shows trying everything until finding solution."
"Esta es tu señal para empezar a invertir en inmuebles.",Urgency,"Guille shows sign to start investing now."
"3 cosas que me ayudaron a conseguir libertad financiera.",Number-Driven,"Guille shows 3 specific things that led to financial freedom."
"7 hábitos que cambiaron todo para mí en inversión inmobiliaria.",Number-Driven,"Guille shows 7 habits that transformed investment success."
"Aquí están las 6 cosas que nadie te cuenta sobre invertir en inmuebles.",Number-Driven,"Guille shows 6 hidden truths about real estate investment."
"Cómo conseguí 10 propiedades en solo 4 pasos.",Number-Driven,"Guille shows 4-step process to get 10 properties."
"3 cosas que desearía haber sabido antes de empezar en inmobiliario.",Problem-Solution,"Guille shows 3 things to know before starting."
"Ese momento incómodo cuando... tu piso no genera los ingresos esperados.",Problem-Solution,"Guille shows awkward moment when investment doesn't perform."
"Si haces inversiones inmobiliarias sin estrategia, necesitamos hablar.",Problem-Solution,"Guille shows need to discuss strategy-less investing."
"Día en la vida de un inversor inmobiliario exitoso.",Lifestyle,"Guille shows typical day of successful property investor."
