Hook Text,Category,Filming Instructions
"Odio admitirlo, pero estoy obsesionado con encontrar oportunidades inmobiliarias.",Lifestyle,"Guille shows obsession with finding property opportunities."
"Por favor no me juzgues, pero... mi piso me paga las vacaciones.",Lifestyle,"Guille shows property paying for lifestyle without judgment."
"No puedo creer que esté diciendo esto, pero... invertir sin dinero es más fácil.",Credibility,"Guille shows surprising truth about no-money-down investing."
"Necesitas ver esto si quieres libertad financiera.",Urgency,"Guille shows must-see content for financial freedom."
"¡Dios mío, necesitas ver esto!",Urgency,"Guille shows excited reaction to amazing opportunity."
"Tengo una confesión que hacer...",Credibility,"Guille shows honest confession about investment journey."
"Es un poco vergonzoso decirlo en voz alta, pero he estado invirtiendo mal durante años.",Problem-Solution,"Guille shows embarrassing admission of wrong investment approach."
"Una cosa que desearía haber sabido antes es...",Problem-Solution,"Guille shows wishing for knowledge earlier."
"Oficialmente soy un converso de la inversión inmobiliaria creativa.",Transformation,"Guille shows conversion to creative real estate investing."
"Pensé que esto iba a ser una pérdida de dinero... pero me equivoqué.",Transformation,"Guille shows expecting loss but getting gains."
"No vas a creer lo que esta estrategia hizo con mi patrimonio inmobiliario.",Curiosity,"Guille shows unbelievable results from strategy."
"Esta estrategia es lo mejor que he comprado este año.",Credibility,"Guille shows best investment of the year."
"Esta estrategia hizo mi vida 10 veces más fácil.",Transformation,"Guille shows strategy making life much easier."
"Vas a querer ver esto.",Curiosity,"Guille shows must-see content."
"Encontré la solución perfecta para la rentabilidad inmobiliaria.",Problem-Solution,"Guille shows perfect solution for property returns."
"¡Chicos! Esta estrategia es revolucionaria!",Excitement,"Guille shows excitement about game-changing strategy."
"No esperaba decir esto, pero estoy enamorado de esta estrategia.",Transformation,"Guille shows unexpected love for investment strategy."
"Llevo semanas queriendo hablar sobre esto.",Urgency,"Guille shows wanting to share for weeks."
"No suelo impresionarme. Pero vaya.",Credibility,"Guille shows being impressed by strategy."
"Lo compré como una broma. Y ahora no puedo vivir sin ello.",Transformation,"Guille shows buying as joke but becoming essential."
"Esta es la única estrategia que llevo en mi cartera 24/7.",Lifestyle,"Guille shows strategy that's always with you."
"Si eres serio sobre la libertad financiera, necesitas esto.",Urgency,"Guille shows essential for serious financial freedom seekers."
"Si tienes menos de 30 años, este video es para ti.",Targeted,"Guille shows targeting young investors specifically."
"Aquí hay algo que desearía que alguien me hubiera dicho cuando tenía 20 años.",Problem-Solution,"Guille shows advice for 20-somethings."
"Mi mejor descubrimiento inmobiliario este mes.",Credibility,"Guille shows best real estate find of the month."
"Aquí está cómo solucioné mi rentabilidad inmobiliaria sin gastar una fortuna.",Problem-Solution,"Guille shows fixing returns without spending much."
"Estrategias que desearía haber comprado antes: Parte 1.",Number-Driven,"Guille shows strategies wished bought sooner."
"Una cosa que he aprendido en 5 años es que...",Credibility,"Guille shows lesson learned over 5 years."
"Si tu cartera inmobiliaria se ve así, eres un inversor novato.",Problem-Solution,"Guille shows identifying rookie investor signs."
"Si quieres impresionar a alguien con tu patrimonio inmobiliario, haz esto.",Educational,"Guille shows how to impress with property portfolio."
"Esta es la razón por la que necesitas esta estrategia.",Urgency,"Guille shows why strategy is needed."
"Literalmente espero que todo el mundo en el mundo haga esto.",Aspirational,"Guille shows hoping everyone uses this strategy."
"Esto es lo que se ve una gran inversión inmobiliaria.",Educational,"Guille shows what great investment looks like."
"¿Por qué todo el mundo está obsesionado de repente con la inversión inmobiliaria?",Curiosity,"Guille shows sudden obsession with real estate."
"¿Qué pasaría si te dijera que has estado invirtiendo mal todo este tiempo?",Problem-Solution,"Guille shows shocking revelation about wrong approach."
"Lo que nadie te cuenta sobre empezar en inmobiliario.",Problem-Solution,"Guille shows hidden truths about starting in real estate."
"3 señales de alarma al elegir propiedades para invertir.",Educational,"Guille shows 3 red flags when choosing properties."
"Deja de hacer esto si quieres libertad financiera.",Problem-Solution,"Guille shows stop doing this for financial freedom."
"Cómo pasé de empleado a inversor inmobiliario exitoso.",Transformation,"Guille shows transformation from employee to successful investor."
"Hice esto todos los días de la semana y aquí está lo que pasó.",Number-Driven,"Guille shows daily action and results."
"Si tienes entre 25 y 35 años.",Targeted,"Guille shows targeting specific age group."
"Mira hasta el final.",Urgency,"Guille shows important ending to watch."
"Roba esta estrategia para tu libertad financiera.",Educational,"Guille shows stealing strategy for financial freedom."
"No sé quién necesita escuchar esto, pero...",Problem-Solution,"Guille shows advice for someone who needs it."
"¿Soy solo yo o... el mercado inmobiliario está cambiando?",Curiosity,"Guille shows questioning market changes."
"Aquí hay un consejo rápido para inversores inmobiliarios.",Educational,"Guille shows quick tip for property investors."
"¿Podemos admitir que la inversión inmobiliaria es la mejor de todos los tiempos?",Aspirational,"Guille shows admitting real estate is the best investment."
"Esta estrategia inmobiliaria podría meterme en problemas.",Curiosity,"Guille shows strategy that might be controversial."
"¿Cuál es una cosa que todo inversor inmobiliario exitoso tiene en común?",Educational,"Guille shows common trait of successful investors."
"POV: Eres un inversor inmobiliario ganando €5,000 al mes, con solo 3 propiedades.",Lifestyle,"Guille shows point of view of successful investor."
"Este es un recordatorio amistoso de que... tu dinero pierde valor en el banco.",Problem-Solution,"Guille shows friendly reminder about money losing value."
"El impulso femenino de... querer seguridad financiera a través de propiedades.",Targeted,"Guille shows female urge for financial security through properties."
"¿Podemos normalizar... invertir en inmuebles sin dinero inicial?",Educational,"Guille shows normalizing no-money-down investing."
"Este es el peor consejo inmobiliario del mundo.",Problem-Solution,"Guille shows worst real estate advice."
"Esta estrategia inmobiliaria está totalmente desactualizada.",Problem-Solution,"Guille shows outdated strategy."
"¡Invertir solo con ahorros es una mentira total! Estas son las únicas 3 cosas que te ayudarán a conseguir libertad financiera.",Problem-Solution,"Guille shows traditional approach is lie, reveals 3 real solutions."
"¿Es la inversión inmobiliaria una estafa?",Curiosity,"Guille shows questioning if real estate investment is scam."
"Este chico es famoso por... transformar propiedades sin dinero.",Credibility,"Guille shows someone famous for creative investing."
"¿Es posible conseguir 5 propiedades y libertad financiera en 3 años?",Curiosity,"Guille shows questioning possibility of quick success."
"Mensaje para inversores inmobiliarios principiantes.",Targeted,"Guille shows message specifically for beginner investors."
"¿Cuál es el secreto para hacer rentable cualquier propiedad?",Curiosity,"Guille shows secret to making any property profitable."
"Aprender esto sobre financiación cambió la forma en que invierto.",Transformation,"Guille shows learning that changed investment approach."
"Creo que me equivoqué... con mi primera inversión inmobiliaria.",Problem-Solution,"Guille shows admitting mistake with first investment."
"Seguro que has oído las noticias... sobre el mercado inmobiliario.",Urgency,"Guille shows referencing current market news."
"Lo que desearía haber sabido a los 25 en lugar de a los 35.",Problem-Solution,"Guille shows wishing for knowledge at younger age."
"¿Por qué el 70% de los inversores inmobiliarios fracasan en sus primeros 2 años?",Educational,"Guille shows questioning why most fail early."
"Si no te gusta la gestión de propiedades, pero aún quieres rentas pasivas, entonces haz esto.",Problem-Solution,"Guille shows solution for those who don't want management."
